{
  "name": "docker",
  "version": "1",
  "detect": [
    { "file": "Dockerfile", "type": "exact" },
    { "file": "Containerfile", "type": "exact" }
  ],
  "filenames": ["dockerfile", "containerfile"],
  "gates": {
    "hadolint": {
      "enabled": false,
      "severity": "warn",
      "trigger": ["verify", "commit"],
      "command": "hadolint {files} 2>&1 | head -30",
      "description": "Dockerfile linter — lint/best-practice only, NOT vulnerability scanning (Trivy/Grype NOT included).",
      "stacks": ["docker"],
      "timeout": 60
    }
  }
}
