{
  "name": "java",
  "version": "1",
  "detect": [
    { "file": "pom.xml", "type": "exact" },
    { "file": "build.gradle", "type": "exact" }
  ],
  "extensions": [".java"],
  "gates": {
    "javac": {
      "enabled": false,
      "severity": "block",
      "trigger": ["verify"],
      "command": "mvn compile -q 2>&1 | head -20",
      "file_extensions": [".java"],
      "description": "Java compilation check",
      "stacks": ["java"]
    }
  }
}
