{
  "name": "helm",
  "version": "1",
  "detect": [
    { "file": "Chart.yaml", "type": "exact" },
    { "file": "Chart.yml", "type": "exact" }
  ],
  "filenames": ["chart.yaml", "chart.yml", "values.yaml", "values.yml"],
  "path_hints": ["/templates/"],
  "assurance_profiles": ["declarative"],
  "gates": {
    "helm-lint": {
      "enabled": false,
      "severity": "warn",
      "trigger": ["verify", "commit"],
      "command": "helm lint . 2>&1 | head -30",
      "description": "Helm chart linter — lint/syntax only, NOT policy-as-code.",
      "stacks": ["helm"],
      "timeout": 60
      ,"evidence_capabilities": ["syntax"]
    }
  }
}
