{
  "name": "terraform",
  "version": "1",
  "detect": [
    { "file": "*.tf", "type": "glob" },
    { "file": "*.tfvars", "type": "glob" }
  ],
  "extensions": [".tf", ".tfvars"],
  "assurance_profiles": ["declarative"],
  "gates": {
    "terraform-validate": {
      "enabled": false,
      "severity": "block",
      "trigger": ["verify", "commit"],
      "command": "terraform fmt -check && terraform validate 2>&1 | head -30",
      "file_extensions": [".tf", ".tfvars"],
      "description": "Terraform fmt+validate — syntax only, NOT policy-as-code (Checkov/tfsec/Sentinel NOT included).",
      "stacks": ["terraform"],
      "timeout": 120
      ,"evidence_capabilities": ["syntax", "schema"]
    }
  }
}
